{
  "title": "",
  "subtitle": "",
  "template": "platform_value_chain",
  "lanes": [
    {
      "side": "left",
      "title": "Inputs",
      "items": []
    },
    {
      "side": "right",
      "title": "Outputs",
      "items": []
    }
  ],
  "zones": [
    {
      "id": "zone_1",
      "title": "",
      "subtitle": "",
      "items": []
    },
    {
      "id": "zone_2",
      "title": "",
      "subtitle": "",
      "items": []
    }
  ],
  "flows": [],
  "operations": [],
  "footer": "",
  "rendering_preferences": {
    "backend": "drawio-skill",
    "format": "png",
    "embed_xml": true
  },
  "decomposition": {
    "auto_expand": true,
    "max_overview_zones": 6,
    "max_items_per_zone_overview": 5,
    "create_capability_children": true
  }
}