{
  "title": "Multi-Cloud Targets \u2014 Level 2 Expansion",
  "subtitle": "Detailed expansion of Multi-Cloud Targets",
  "template": "platform_value_chain",
  "lanes": [],
  "zones": [
    {
      "id": "child_1",
      "title": "AWS EKS",
      "subtitle": "",
      "items": [
        "Primary Cluster",
        "Delegate",
        "Policy Results"
      ],
      "expand": false,
      "children": []
    },
    {
      "id": "child_2",
      "title": "AKS / GCP",
      "subtitle": "",
      "items": [
        "Secondary Cluster",
        "Optional Cluster",
        "Delegate Routing"
      ],
      "expand": false,
      "children": []
    }
  ],
  "flows": [
    {
      "from": "child_1",
      "to": "child_2",
      "label": "detail flow"
    }
  ],
  "operations": [
    "Audit Trail",
    "Governance",
    "Security Controls"
  ],
  "footer": "Level 2 expansion of Multi-Cloud Targets",
  "decomposition": {
    "auto_expand": false,
    "max_overview_zones": 6,
    "max_items_per_zone_overview": 5,
    "create_capability_children": false
  },
  "rendering_preferences": {
    "backend": "drawio-skill",
    "format": "png",
    "embed_xml": true
  }
}