{
  "title": "Architecture Assurance Fabric \u2014 Level 2 Expansion",
  "subtitle": "Detailed expansion of Architecture Assurance Fabric",
  "template": "identity_multicloud_control_plane",
  "lanes": [],
  "zones": [
    {
      "id": "child_1",
      "title": "Build Stage",
      "subtitle": "",
      "items": [
        "Dependency Scan",
        "IaC Plan",
        "Container Image Check"
      ],
      "expand": false,
      "children": []
    },
    {
      "id": "child_2",
      "title": "Deploy Stage",
      "subtitle": "",
      "items": [
        "BCP / DR Gates",
        "LB Spec",
        "Topology Verification"
      ],
      "expand": false,
      "children": []
    }
  ],
  "flows": [
    {
      "from": "child_1",
      "to": "child_2",
      "label": "detail flow"
    }
  ],
  "operations": [
    "Audit Trail",
    "Governance",
    "Security Controls"
  ],
  "footer": "Level 2 expansion of Architecture Assurance Fabric",
  "decomposition": {
    "auto_expand": false,
    "max_overview_zones": 6,
    "max_items_per_zone_overview": 5,
    "create_capability_children": false
  },
  "rendering_preferences": {
    "backend": "drawio-skill",
    "format": "png",
    "embed_xml": true
  }
}