{
  "title": "Cross-Cutting Components \u2014 Level 2 Expansion",
  "subtitle": "Detailed expansion of Cross-Cutting Components",
  "template": "identity_multicloud_control_plane",
  "lanes": [],
  "zones": [
    {
      "id": "child_1",
      "title": "Evidence & Drift",
      "subtitle": "",
      "items": [
        "Immutable Log",
        "Expiry Signals",
        "CVE Alerts"
      ],
      "expand": false,
      "children": []
    },
    {
      "id": "child_2",
      "title": "Waivers",
      "subtitle": "",
      "items": [
        "PR-based Workflow",
        "Expiry Limit",
        "Approval History"
      ],
      "expand": false,
      "children": []
    }
  ],
  "flows": [
    {
      "from": "child_1",
      "to": "child_2",
      "label": "detail flow"
    }
  ],
  "operations": [
    "Audit Trail",
    "Governance",
    "Security Controls"
  ],
  "footer": "Level 2 expansion of Cross-Cutting Components",
  "decomposition": {
    "auto_expand": false,
    "max_overview_zones": 6,
    "max_items_per_zone_overview": 5,
    "create_capability_children": false
  },
  "rendering_preferences": {
    "backend": "drawio-skill",
    "format": "png",
    "embed_xml": true
  }
}